{
    "invoiceNumber": "#INV02081",
    "dateIssued": "2018-11-11",
    "dueDate": "2018-12-01",
    "from": {
        "name": "Stanford Plumbing & Heating",
        "address": "123 Madison drive, Seattle, WA, 7829Q"
    },
    "to": {
        "name": "Allen Smith",
        "address": "87 Private st, Seattle, WA",
        "email": "allen@gmail.com",
        "phone": "990-302-1898"
    },
    "items": [
        {
            "description": "Installed new kitchen sink (hours)",
            "quantity": 3,
            "price": 50.0
        },
        {
            "description": "Toto sink",
            "quantity": 1,
            "price": 500.0
        },
        {
            "description": "Worcester greenstar magnetic system filter",
            "quantity": 1,
            "price": 190.0
        },
        {
            "description": "Nest smart thermostat",
            "quantity": 1,
            "price": 250.0
        },
        {
            "description": "Worcester Greenstar 30i",
            "quantity": 1,
            "price": 1500.0
        }
    ],
    "total": 2844.8
}