{
    "invoiceNumber": "74322107",
    "dateIssued": "2016-02-02",
    "from": {
        "name": "Davis-Obrien",
        "address": "736 Derek Station Suite 883, New Laura, WA 77568"
    },
    "to": {
        "name": "Taylor Ltd",
        "address": "213 Thomas Vista, East Zacharyshire, WI 95033"
    },
    "items": [
        {
            "description": "100cm Nordic Round Area Rug Abstract Geometric Patterns Non-Slip Floor Carpet",
            "quantity": 2.0,
            "price": 30.98
        }
    ],
    "total": 61.96
}